{
  "name": "Doster CV",
  "slug": "doster-cv",
  "section": "About KnowAlgo",
  "type": "pdf",
  "description": "",
  "source": "/assets/pdfs/doster-cv.pdf",
  "pdf": "/assets/pdfs/doster-cv.pdf",
  "previewImage": "/assets/previews/doster-cv.png",
  "value": 8,
  "id": "23adf570-dcb1-40f7-b323-dde0d1002e5b"
}
