{
  "name": "Tactical Sessions",
  "slug": "tactical-sessions",
  "section": "Services",
  "type": "htmlCard",
  "description": "Schedule a session focused on practical next steps and direct technical advice",
  "source": "assets/html/tactical-sessions/index.html",
  "url": "assets/html/tactical-sessions/index.html",
  "previewImage": "assets/html/tactical-sessions/preview.png",
  "value": 17,
  "id": "76e31567-d2ca-418b-9151-cb59a0809fe2"
}
