{
  "name": "URL capture and visual organization",
  "slug": "url-capture-and-visual-organization",
  "section": "Projects",
  "type": "website",
  "description": "",
  "source": "https://www.vaultbubbles.com/",
  "url": "https://www.vaultbubbles.com/",
  "previewImage": "/assets/previews/url-capture-and-visual-organization.png",
  "value": 8,
  "id": "a7f89127-1b9a-4375-94d2-847f15129465"
}
