{
  "name": "Build Decision Making Tools",
  "slug": "service-capabilities",
  "section": "Services",
  "type": "htmlCard",
  "description": "",
  "source": "assets/html/service-capabilities/index.html",
  "url": "assets/html/service-capabilities/index.html",
  "previewImage": "assets/html/service-capabilities/preview.png",
  "value": 16,
  "id": "ed146191-21d8-40af-ba31-a1d0ae9ab8ce"
}
