{
  "name": "My Perspective",
  "slug": "my-perspective",
  "section": "About KnowAlgo",
  "type": "text",
  "description": "",
  "value": 8,
  "html": "<p>I bring a background in institutional investment management and electricity trading to AI driven data analytics.  \r<br>\r<br>Quickly assess risks, grab opportunities, iterate.  Your infrastructure has to be ready to pivot, to identify the new thing and stay robust under deadline.  \r<br>\r<br>You data needs to be labeled, modelled and structured correctly.\r<br>\r<br>You need visual observability to know where you are… without distraction… right now.\r<br>\r<br>You can be creative and dynamic in the moment when you have a solid core.</p>",
  "id": "81499ee0-d510-4e2a-be29-ba743bed67d4"
}
