{
  "name": "Github",
  "slug": "github",
  "section": "Contact Me",
  "type": "website",
  "description": "Explore public work, experiments and technical artifacts",
  "source": "https://github.com/doc1000",
  "url": "https://github.com/doc1000",
  "previewImage": "/assets/previews/github.png",
  "value": 8,
  "id": "977aea08-fe9b-469e-b442-64012cc011b0"
}
