{
  "name": "Process Pillars",
  "slug": "process-pillars",
  "section": "Services",
  "type": "htmlCard",
  "description": "Unify, Evaluate, Visualize",
  "source": "assets/html/process-pillars/index.html",
  "url": "assets/html/process-pillars/index.html",
  "previewImage": "assets/html/process-pillars/preview.png",
  "value": 8,
  "id": "35150f5e-50db-4d00-9961-22c80d923436"
}
