{
  "name": "Services",
  "slug": "sec-services",
  "section": "Home",
  "type": "section",
  "description": "See your edge.\n\nMulti-modal analytics and AI-native data flows.  Unlocked in weeks, not months.  For founders, traders, product managers.",
  "value": 52,
  "color": "#8b79b8",
  "id": "9014ba4c-1874-4b8b-bffe-9751167b94d3"
}
