{
  "name": "Doster Esh",
  "slug": "doster-esh",
  "section": "About KnowAlgo",
  "type": "htmlCard",
  "description": "",
  "source": "/assets/html/doster-esh/index.html",
  "url": "/assets/html/doster-esh/index.html",
  "previewImage": "/assets/html/doster-esh/preview.png",
  "value": 60,
  "id": "bb61177f-6dbb-4c23-9d06-11a807b5f90d"
}
