{
  "name": "MyLinkedIn",
  "slug": "mylinkedin",
  "section": "Contact Me",
  "type": "website",
  "description": "Connect professionally and see current background, work, and updates.",
  "source": "https://www.linkedin.com/in/dosteresh/",
  "url": "https://www.linkedin.com/in/dosteresh/",
  "previewImage": "assets/previews/mylinkedin.png",
  "value": 8,
  "id": "bc609cb3-b763-4d62-bac2-5ead68fe3596"
}
